[
  {
    "id": "ed:gita.sa.src",
    "type": "Edition",
    "work": "work:gita",
    "kind": "source",
    "language": "sa",
    "script": "Deva",
    "direction": "ltr",
    "title": "Bhagavad Gītā, received Sanskrit text",
    "translator": null,
    "year": null,
    "authority": "primary",
    "immutable": true,
    "normalization": "nfc",
    "divine_name_policy": null,
    "license": {
      "id": "PD",
      "jurisdiction_notes": "Ancient text; no rights subsist in the Sanskrit."
    }
  },
  {
    "id": "ed:gita.en.telang",
    "type": "Edition",
    "work": "work:gita",
    "kind": "translation",
    "language": "en",
    "script": "Latn",
    "direction": "ltr",
    "title": "The Bhagavadgîtâ, trans. Kâshinâth Trimbak Telang, Sacred Books of the East vol. 8",
    "translator": "Kāshināth Trimbak Telang",
    "year": 1882,
    "authority": "secondary",
    "immutable": false,
    "normalization": "nfc",
    "divine_name_policy": null,
    "license": {
      "id": "PD",
      "jurisdiction_notes": "Published 1882; public domain worldwide."
    }
  },
  {
    "id": "ed:analects.lzh.src",
    "type": "Edition",
    "work": "work:analects",
    "kind": "source",
    "language": "lzh",
    "script": "Hant",
    "direction": "ltr",
    "title": "論語, received text",
    "translator": null,
    "year": null,
    "authority": "primary",
    "immutable": true,
    "normalization": "nfc",
    "divine_name_policy": null,
    "license": {
      "id": "PD"
    }
  },
  {
    "id": "ed:analects.en.legge",
    "type": "Edition",
    "work": "work:analects",
    "kind": "translation",
    "language": "en",
    "script": "Latn",
    "direction": "ltr",
    "title": "The Chinese Classics vol. I, trans. James Legge",
    "translator": "James Legge",
    "year": 1861,
    "authority": "secondary",
    "immutable": false,
    "normalization": "nfc",
    "divine_name_policy": null,
    "license": {
      "id": "PD"
    }
  },
  {
    "id": "ed:quran.ar.uthmani",
    "type": "Edition",
    "work": "work:quran",
    "kind": "source",
    "language": "ar",
    "script": "Arab",
    "direction": "rtl",
    "title": "المصحف — Uthmānī text",
    "translator": null,
    "year": null,
    "authority": "primary",
    "immutable": true,
    "normalization": "nfc",
    "divine_name_policy": null,
    "license": {
      "id": "PD",
      "jurisdiction_notes": "The Arabic text is public domain. Stored form is never normalised for search convenience; a normalised index is built separately and never displayed."
    }
  },
  {
    "id": "ed:quran.en.pickthall",
    "type": "Edition",
    "work": "work:quran",
    "kind": "translation",
    "language": "en",
    "script": "Latn",
    "direction": "ltr",
    "title": "The Meaning of the Glorious Koran, Marmaduke Pickthall",
    "translator": "Marmaduke Pickthall",
    "year": 1930,
    "authority": "interpretive-of-meaning",
    "immutable": false,
    "normalization": "nfc",
    "divine_name_policy": null,
    "license": {
      "id": "PD",
      "jurisdiction_notes": "Public domain in most jurisdictions. Modern translations (e.g. Sahih International) are NOT free — never assume."
    }
  },
  {
    "id": "ed:bible.he.wlc",
    "type": "Edition",
    "work": "work:bible",
    "kind": "source",
    "language": "he",
    "script": "Hebr",
    "direction": "rtl",
    "title": "Westminster Leningrad Codex",
    "translator": null,
    "year": null,
    "authority": "primary",
    "immutable": true,
    "normalization": "nfc",
    "divine_name_policy": "preserve-tetragrammaton",
    "license": {
      "id": "PD",
      "source_url": "https://tanach.us/"
    }
  },
  {
    "id": "ed:bible.en.kjv",
    "type": "Edition",
    "work": "work:bible",
    "kind": "translation",
    "language": "en",
    "script": "Latn",
    "direction": "ltr",
    "title": "King James Version",
    "translator": null,
    "year": 1611,
    "authority": "secondary",
    "immutable": false,
    "normalization": "nfc",
    "divine_name_policy": "LORD-small-caps",
    "license": {
      "id": "PD",
      "jurisdiction_notes": "Public domain outside the United Kingdom. In the UK the KJV remains under perpetual Crown letters patent — recorded per-jurisdiction, not filed as flatly 'public domain'."
    }
  },
  {
    "id": "ed:ddj.lzh.wangbi",
    "type": "Edition",
    "work": "work:daodejing",
    "kind": "source",
    "language": "lzh",
    "script": "Hant",
    "direction": "ltr",
    "title": "道德經 — received (Wang Bi) text",
    "translator": null,
    "year": null,
    "authority": "primary",
    "immutable": true,
    "normalization": "nfc",
    "divine_name_policy": null,
    "license": {
      "id": "PD"
    }
  },
  {
    "id": "ed:ddj.lzh.mawangdui",
    "type": "Edition",
    "work": "work:daodejing",
    "kind": "critical",
    "language": "lzh",
    "script": "Hant",
    "direction": "ltr",
    "title": "馬王堆帛書 — Mawangdui silk manuscript",
    "translator": null,
    "year": -168,
    "authority": "primary",
    "immutable": true,
    "normalization": "nfc",
    "divine_name_policy": null,
    "license": {
      "id": "PD",
      "jurisdiction_notes": "Excavated 1973. The manuscript is PD; a modern scholarly reconstruction of it may not be."
    }
  },
  {
    "id": "ed:ddj.en.legge",
    "type": "Edition",
    "work": "work:daodejing",
    "kind": "translation",
    "language": "en",
    "script": "Latn",
    "direction": "ltr",
    "title": "The Tao Teh King, trans. James Legge, Sacred Books of the East vol. 39",
    "translator": "James Legge",
    "year": 1891,
    "authority": "secondary",
    "immutable": false,
    "normalization": "nfc",
    "divine_name_policy": null,
    "license": {
      "id": "PD"
    }
  },
  {
    "id": "ed:upanishad.sa.src",
    "type": "Edition",
    "work": "work:upanishad",
    "kind": "source",
    "language": "sa",
    "script": "Deva",
    "direction": "ltr",
    "title": "Principal Upaniṣads, received Sanskrit text",
    "translator": null,
    "year": null,
    "authority": "primary",
    "immutable": true,
    "normalization": "nfc",
    "divine_name_policy": null,
    "license": {
      "id": "PD"
    }
  },
  {
    "id": "ed:upanishad.en.muller",
    "type": "Edition",
    "work": "work:upanishad",
    "kind": "translation",
    "language": "en",
    "script": "Latn",
    "direction": "ltr",
    "title": "The Upanishads, trans. F. Max Müller, Sacred Books of the East vols. 1 & 15",
    "translator": "Friedrich Max Müller",
    "year": 1879,
    "authority": "secondary",
    "immutable": false,
    "normalization": "nfc",
    "divine_name_policy": null,
    "license": {
      "id": "PD"
    }
  },
  {
    "id": "ed:dhp.pi.src",
    "type": "Edition",
    "work": "work:dhammapada",
    "kind": "source",
    "language": "pi",
    "script": "Latn",
    "direction": "ltr",
    "title": "Dhammapada, Pāli text in roman transliteration",
    "translator": null,
    "year": null,
    "authority": "primary",
    "immutable": true,
    "normalization": "nfc",
    "divine_name_policy": null,
    "license": {
      "id": "PD",
      "jurisdiction_notes": "Pāli canon text is public domain. Note the script question: Pāli is written in Sinhala, Thai, Burmese, Khmer and Devanāgarī scripts as well as roman. Roman is the interoperable choice, not the authoritative one — a per-script transliteration edition is owed to each community."
    }
  },
  {
    "id": "ed:dhp.en.muller",
    "type": "Edition",
    "work": "work:dhammapada",
    "kind": "translation",
    "language": "en",
    "script": "Latn",
    "direction": "ltr",
    "title": "The Dhammapada, trans. F. Max Müller, Sacred Books of the East vol. 10",
    "translator": "Friedrich Max Müller",
    "year": 1881,
    "authority": "secondary",
    "immutable": false,
    "normalization": "nfc",
    "divine_name_policy": null,
    "license": {
      "id": "PD"
    }
  }
]
